id_misi;nm_misi;periode;a_aktif;created_at;updated_at;deleted_at;id_updater
e05f8070-dfeb-429a-bc3f-3ee5e2b5c7ce;Menjamin pelayanan darah yang berkualitas dan dalam jumlah yang cukup;2023;1;26/12/2022 16:53;26/12/2022 16:53;NULL;NULL
2711ecb5-f385-4018-b852-d83547eb3142;Mengembangkan kualitas sumberdaya manusia yang kompeten dan profesional;2023;1;26/12/2022 16:53;26/12/2022 16:53;NULL;NULL
702f7bd5-e10c-4890-8db7-ef76a037e9ec;Meningkatkan sarana dan prasarana yang sesuai standar dalam menghasilkan darah yang berkualitas;2023;1;26/12/2022 16:53;26/12/2022 16:53;NULL;NULL
e69f4e55-2a0a-4489-933c-f456072b06db;Membangun komunikasi yang baik dengan stakeholders;2023;1;26/12/2022 16:53;26/12/2022 16:53;NULL;NULL
756a9d30-81db-42b0-8ed7-b9b8c43de93e;Mewujudkan semua bagian pelayanan dengan sistem paperless berbasis mobile;2023;1;26/12/2022 16:53;26/12/2022 16:53;NULL;NULL
